{
  "canonical_admission": "NOT_EVALUATED",
  "completeness": "COMPLETE_INPUT_VIEW",
  "conformance": {
    "canonical_admission": "NOT_EVALUATED",
    "chart_axis_rescaled": false,
    "completeness": "COMPLETE_INPUT_VIEW",
    "current_authority": "NOT_EVALUATED",
    "decision": {
      "action": "SINGLE_COMPLETE",
      "rationale": "entire declared source is visible in this projection",
      "status": "descriptive_display_only"
    },
    "dimensions": {
      "granularity": "detail",
      "lens": "cube.lens.semantics",
      "view": "cube.tree"
    },
    "displayed_item_ids": [
      "core",
      "runtime",
      "adapter",
      "connector",
      "toolbox"
    ],
    "displayed_lens_declarations": 9,
    "displayed_source_edge_ids": [
      "e1",
      "e2",
      "e3",
      "e4"
    ],
    "epistemic_warrant": "NOT_EVALUATED",
    "format": "aiaeao.cube.vp05-conformance-report/1",
    "invariants_passed": [
      "SOURCE_SHA256_LOCK",
      "CUBE_VIEW_NAMESPACE",
      "DECLARED_LENS_ONLY",
      "GRANULARITY_SCOPE",
      "EXACT_ITEM_PARTITION",
      "EXACT_EDGE_PARTITION",
      "LOSS_LEDGER_BALANCED",
      "ORIGINAL_ITEMS_UNCHANGED",
      "ORIGINAL_EDGES_UNCHANGED",
      "TREE_ANCESTOR_CLOSURE",
      "LENS_EDGE_REMAP_DECLARED",
      "EXACT_LENS_BINDING_PARTITION",
      "SVG_SOURCE_LOCK",
      "NO_ACTIVE_SVG_CONTENT",
      "ONE_EMBEDDED_LOSS_LEDGER",
      "EMBEDDED_REPORT_MATCH",
      "NO_SEMANTIC_AUTHORITY_PROMOTION",
      "SOURCE_IS_DECLARED_UNVERIFIED"
    ],
    "limits": [
      "Split feasibility is a heuristic, not a generated multi-page export or optimal partition",
      "Glyph rendering varies with installed fonts",
      "P1 semantic conformance is not evaluated by the SVG printer"
    ],
    "omitted_item_ids": [],
    "omitted_lens_declarations": 0,
    "omitted_source_edge_ids": [],
    "profile": "P2-VP-CONFORMANCE/0.5.0",
    "reference_version": "v9.4",
    "source_bundle_sha256": "01d07868b1f71e03c2a240ac83e31627c63cf5aa84f09c211e704d762ae51e15",
    "source_status": "declared_unverified",
    "split_feasibility": {
      "estimated_panel_count": 1,
      "is_minimum_proven": false,
      "panels": [
        {
          "focus": null,
          "shown_edge_ids": [
            "e1",
            "e2",
            "e3",
            "e4"
          ],
          "shown_item_ids": [
            "adapter",
            "connector",
            "core",
            "runtime",
            "toolbox"
          ]
        }
      ],
      "panels_materialized": false,
      "repeated_item_ids": [],
      "status": "NOT_REQUIRED",
      "strategy": "focused_panels_from_immutable_source",
      "unavailable_focus_count": 0,
      "uncovered_edge_ids": [],
      "uncovered_item_ids": []
    },
    "status": "PASS",
    "svg_sha256": "aaaf516de09a6b0629f6e8953f4ea22fd66da86e63d119bbd49973e4007c63ad",
    "vp04_report_sha256": "45a622d5b038b332bcd57dbde1b74d792e36264f1530eba884920920427f8e0b"
  },
  "current_authority": "NOT_EVALUATED",
  "decision": {
    "action": "SINGLE_COMPLETE",
    "rationale": "entire declared source is visible in this projection",
    "status": "descriptive_display_only"
  },
  "dimensions": {
    "granularity": "detail",
    "lens": "cube.lens.semantics",
    "view": "cube.tree"
  },
  "epistemic_warrant": "NOT_EVALUATED",
  "format": "aiaeao.cube.vp06-print-result/1",
  "limitations": [
    "The source and facet declarations are unverified",
    "P1 semantic conformance is not evaluated",
    "Font availability varies by rendering environment",
    "Split feasibility is not an automatic multi-SVG export"
  ],
  "loss_ledger": {
    "displayed_item_ids": [
      "core",
      "runtime",
      "adapter",
      "connector",
      "toolbox"
    ],
    "displayed_lens_declarations": 9,
    "displayed_source_edge_ids": [
      "e1",
      "e2",
      "e3",
      "e4"
    ],
    "omitted_item_ids": [],
    "omitted_lens_declarations": 0,
    "omitted_source_edge_ids": []
  },
  "profile": "P2-VP/1.0.0-rc1",
  "reference_version": "v9.4",
  "request_sha256": "8d4fca78f2831068cbdf6d99f625bb2613cd49198803ba22afb691e185c3c655",
  "source_bundle_sha256": "01d07868b1f71e03c2a240ac83e31627c63cf5aa84f09c211e704d762ae51e15",
  "split_feasibility": {
    "estimated_panel_count": 1,
    "is_minimum_proven": false,
    "panels": [
      {
        "focus": null,
        "shown_edge_ids": [
          "e1",
          "e2",
          "e3",
          "e4"
        ],
        "shown_item_ids": [
          "adapter",
          "connector",
          "core",
          "runtime",
          "toolbox"
        ]
      }
    ],
    "panels_materialized": false,
    "repeated_item_ids": [],
    "status": "NOT_REQUIRED",
    "strategy": "focused_panels_from_immutable_source",
    "unavailable_focus_count": 0,
    "uncovered_edge_ids": [],
    "uncovered_item_ids": []
  },
  "status": "PASS",
  "svg_sha256": "aaaf516de09a6b0629f6e8953f4ea22fd66da86e63d119bbd49973e4007c63ad"
}
