{
  "canonical_admission": "NOT_EVALUATED",
  "completeness": "COMPLETE_INPUT_VIEW",
  "conformance": {
    "canonical_admission": "NOT_EVALUATED",
    "chart_axis_rescaled": false,
    "completeness": "COMPLETE_INPUT_VIEW",
    "current_authority": "NOT_EVALUATED",
    "decision": {
      "action": "SINGLE_COMPLETE",
      "rationale": "entire declared source is visible in this projection",
      "status": "descriptive_display_only"
    },
    "dimensions": {
      "granularity": "standard",
      "lens": "cube.lens.provenance",
      "view": "cube.flow"
    },
    "displayed_item_ids": [
      "artifact",
      "resource"
    ],
    "displayed_lens_declarations": 9,
    "displayed_source_edge_ids": [
      "e1"
    ],
    "epistemic_warrant": "NOT_EVALUATED",
    "format": "aiaeao.cube.vp05-conformance-report/1",
    "invariants_passed": [
      "SOURCE_SHA256_LOCK",
      "CUBE_VIEW_NAMESPACE",
      "DECLARED_LENS_ONLY",
      "GRANULARITY_SCOPE",
      "EXACT_ITEM_PARTITION",
      "EXACT_EDGE_PARTITION",
      "LOSS_LEDGER_BALANCED",
      "ORIGINAL_ITEMS_UNCHANGED",
      "ORIGINAL_EDGES_UNCHANGED",
      "LENS_EDGE_REMAP_DECLARED",
      "EXACT_LENS_BINDING_PARTITION",
      "SVG_SOURCE_LOCK",
      "NO_ACTIVE_SVG_CONTENT",
      "ONE_EMBEDDED_LOSS_LEDGER",
      "EMBEDDED_REPORT_MATCH",
      "NO_SEMANTIC_AUTHORITY_PROMOTION",
      "SOURCE_IS_DECLARED_UNVERIFIED"
    ],
    "limits": [
      "Split feasibility is a heuristic, not a generated multi-page export or optimal partition",
      "Glyph rendering varies with installed fonts",
      "P1 semantic conformance is not evaluated by the SVG printer"
    ],
    "omitted_item_ids": [],
    "omitted_lens_declarations": 0,
    "omitted_source_edge_ids": [],
    "profile": "P2-VP-CONFORMANCE/0.5.0",
    "reference_version": "v9.4",
    "source_bundle_sha256": "364e9b33d95ab0419410136287ac3f3e0d4e55ec8a7d5eaa66611dc26eaaf4ed",
    "source_status": "declared_unverified",
    "split_feasibility": {
      "estimated_panel_count": 1,
      "is_minimum_proven": false,
      "panels": [
        {
          "focus": null,
          "shown_edge_ids": [
            "e1"
          ],
          "shown_item_ids": [
            "artifact",
            "resource"
          ]
        }
      ],
      "panels_materialized": false,
      "repeated_item_ids": [],
      "status": "NOT_REQUIRED",
      "strategy": "focused_panels_from_immutable_source",
      "unavailable_focus_count": 0,
      "uncovered_edge_ids": [],
      "uncovered_item_ids": []
    },
    "status": "PASS",
    "svg_sha256": "4fd7fc3ff8067e45ae184810c0b9a85578f3ef17ecb0b7c1263f4ea9e18b9fb9",
    "vp04_report_sha256": "0e7a244b90eafc7b24ec34587256b046c633013340bd1e9cb165979bb26328be"
  },
  "current_authority": "NOT_EVALUATED",
  "decision": {
    "action": "SINGLE_COMPLETE",
    "rationale": "entire declared source is visible in this projection",
    "status": "descriptive_display_only"
  },
  "dimensions": {
    "granularity": "standard",
    "lens": "cube.lens.provenance",
    "view": "cube.flow"
  },
  "epistemic_warrant": "NOT_EVALUATED",
  "format": "aiaeao.cube.vp06-print-result/1",
  "limitations": [
    "The source and facet declarations are unverified",
    "P1 semantic conformance is not evaluated",
    "Font availability varies by rendering environment",
    "Split feasibility is not an automatic multi-SVG export"
  ],
  "loss_ledger": {
    "displayed_item_ids": [
      "artifact",
      "resource"
    ],
    "displayed_lens_declarations": 9,
    "displayed_source_edge_ids": [
      "e1"
    ],
    "omitted_item_ids": [],
    "omitted_lens_declarations": 0,
    "omitted_source_edge_ids": []
  },
  "profile": "P2-VP/1.0.0-rc1",
  "reference_version": "v9.4",
  "request_sha256": "cce72373bcad57655206d4963f84851bf24757cc55845442a70658496a4f6f04",
  "source_bundle_sha256": "364e9b33d95ab0419410136287ac3f3e0d4e55ec8a7d5eaa66611dc26eaaf4ed",
  "split_feasibility": {
    "estimated_panel_count": 1,
    "is_minimum_proven": false,
    "panels": [
      {
        "focus": null,
        "shown_edge_ids": [
          "e1"
        ],
        "shown_item_ids": [
          "artifact",
          "resource"
        ]
      }
    ],
    "panels_materialized": false,
    "repeated_item_ids": [],
    "status": "NOT_REQUIRED",
    "strategy": "focused_panels_from_immutable_source",
    "unavailable_focus_count": 0,
    "uncovered_edge_ids": [],
    "uncovered_item_ids": []
  },
  "status": "PASS",
  "svg_sha256": "4fd7fc3ff8067e45ae184810c0b9a85578f3ef17ecb0b7c1263f4ea9e18b9fb9"
}
